{
  "event_id": "evt_interlink-test",
  "trace_id": "trc_interlink-test",
  "event_type": "signal.ingested",
  "schema_version": "1.0",
  "created_at": "2026-08-12T03:30:17Z",
  "source": {
    "repo": "AVOT-ARCHIVIST",
    "workflow": "Archivist Emit Event",
    "path": "processed/signals/interlink-test.json"
  },
  "routing": {
    "target_repo": "AVOT-engine-core",
    "target_workflow": "Engine Runner",
    "target_avot": "AVOT-Core"
  },
  "payload": {
    "signal_id": "sig_interlink-test",
    "type": "research",
    "title": "Inter-Repo Activation Test 2 AVOT engine",
    "summary": "Testing Archivist → Engine → Control Center handoff",
    "priority": "medium",
    "content_path": "processed/signals/interlink-test.json"
  },
  "governance": {
    "value_profile": "default",
    "invariant_profile": "default",
    "review_required": false
  },
  "status": {
    "state": "new",
    "decision": null,
    "error": null
  }
}
