{
  "event_id": "evt_control center test",
  "trace_id": "trc_control center test",
  "event_type": "signal.ingested",
  "schema_version": "1.0",
  "created_at": "2026-08-12T02:53:42Z",
  "source": {
    "repo": "AVOT-ARCHIVIST",
    "workflow": "Archivist Emit Event",
    "path": "processed/signals/control center test.json"
  },
  "routing": {
    "target_repo": "AVOT-engine-core",
    "target_workflow": "Engine Runner",
    "target_avot": "AVOT-Core"
  },
  "payload": {
    "signal_id": "sig_control center test",
    "type": "signal",
    "title": "Control Center avot Test 2",
    "summary": "Testing full pipeline",
    "priority": "low",
    "content_path": "processed/signals/control center test.json"
  },
  "governance": {
    "value_profile": "default",
    "invariant_profile": "default",
    "review_required": false
  },
  "status": {
    "state": "new",
    "decision": null,
    "error": null
  }
}
